call_id,start_sec,system_text,human_text,text_similarity,combined_score,system_role,human_role,label_correct,text_override,override_phrase,status
food_malay,0.0,"Samap petang, pusat bantuan makan sini, saya cik. Boleh saya bantu, cik?",Selamat petang Pusat Bantuan Makan Sini saya Siti Boleh saya bantu encik,0.889,0.897,Agent,Agent,True,False,,✅ CORRECT
food_malay,5.16,"Hello, cik. Saya nak tanya pasal pesanan saya tadi. Saya baru perasan ada barang",Hello Siti saya nak tanya pasal pesanan saya tadi Saya baru perasan ada barang y,0.956,0.915,Customer,Customer,True,False,,✅ CORRECT
food_malay,11.96,"Minta maaf atas kesulitan tersebut, cik. Boleh saya dapatkan nombor pesanan cik ",Minta maaf atas kesulitan tersebut encik Boleh saya dapatkan nombor pesanan enci,0.966,0.899,Agent,Agent,True,False,,✅ CORRECT
food_malay,18.28,Nombo dia MS8821. Saya pesan set nasi lemak ayam berempah dengan air sirap. Tapi,Nombor dia M S lapan lapan dua satu Saya pesan set nasi lemak ayam berempah deng,0.777,0.658,Customer,Customer,True,False,,✅ CORRECT
food_malay,31.86,Saya faham perasaan ujik. Saya pun akan kecewa kalau jadi macam ni. Berdasarkan ,Saya faham perasaan encik saya pun akan kecewa kalau jadi macam ni Berdasarkan r,0.948,0.569,Agent,Agent,True,False,,✅ CORRECT
food_malay,40.02,"Encik nak saya pulangkan duit, refund untuk bahagian ayam itu atau encik nak bau",Encik nak saya pulangkan duit atau encik nak baucar untuk pesanan akan datang,0.806,0.484,Customer,Agent,False,False,,❌ WRONG
food_malay,46.14,"Kalau boleh, saya nak refund sahajalah. Sebab saya dah lapar sangat ni, kena bel",Kalau boleh saya nak refund sajalah sebab saya dah lapar sangat ni kena beli mak,0.971,0.583,Customer,Customer,True,True,saya nak refund,✅ CORRECT
food_malay,52.86,Baiklah. Saya akan uruskan proses bayaran balik setemerta.,Okaylah kalau macam tu Harap lepas ni pihak restoran lebih peka lah ya jangan cu,0.184,0.51,Agent,Customer,False,False,,❌ WRONG
food_malay,56.6,Proses ini akan mengambil masa dalam 24 jam untuk masuk semula ke dalam e-wallet,Betul encik kami akan hantar maklum balas tegas kepada pihak restoran Ada apa ap,0.268,0.526,Customer,Agent,False,False,,❌ WRONG
